{
  "$schema": "https://json-schema.org/draft/2020-12/schema",
  "$id": "https://github.com/durable-workflow/.github/blob/main/beta-continuity/schema.json",
  "title": "Durable Workflow workspace-unavailable beta continuity drill",
  "type": "object",
  "additionalProperties": false,
  "required": [
    "$schema",
    "authority_issue",
    "channel",
    "drill",
    "first_component",
    "plan_prefix",
    "required_issue_labels"
  ],
  "properties": {
    "$schema": { "const": "./schema.json" },
    "authority_issue": {
      "type": "object",
      "additionalProperties": false,
      "required": ["number", "repository", "work_id"],
      "properties": {
        "number": { "type": "integer", "minimum": 1 },
        "repository": { "const": "durable-workflow/.github" },
        "work_id": { "const": "github-only-beta-continuity-drill" }
      }
    },
    "channel": { "const": "alpha" },
    "drill": {
      "type": "string",
      "pattern": "^[a-z0-9][a-z0-9._-]{0,79}$"
    },
    "first_component": {
      "enum": ["workflow", "waterline", "server", "cli", "sdk-php", "sdk-python", "sdk-rust"]
    },
    "plan_prefix": {
      "type": "string",
      "pattern": "^[a-z0-9][a-z0-9-]{0,35}$"
    },
    "required_issue_labels": {
      "type": "array",
      "minItems": 1,
      "uniqueItems": true,
      "items": { "type": "string", "minLength": 1 }
    }
  }
}
